anvaya,anvayaInfo,canto,english,englishInfo,hindi,hindiInfo,pada,padaInfo,sloka,slokaNo
अन्वयक्रमः -,अष्टापदभूमिरेणुः पदाहतः (सन् अपि ) महाजनानां शिरांसि न लङ्घयामास । (किञ्च-) उद्धतिं न एव आजगाम यत् गरिम्णः सदृशम् अचेष्टत ।,canto3,English Translation- ,"The dust of the ground of gold, trodden by so many feet, did not ascend to the heads of the populace nor did it rise, but only acted in a way in keeping with its heaviness.",हिन्दीभावार्थ -,"स्वर्ण भूमि की धूलि ने पैरों से ताडित होने पर भी बड़े होने पर भी बड़े लोगों के मस्तकों को आक्नान्त नहीं किया । (जड़कर मनुष्यों के मस्तक पर नही पड़ी) और औद्धत्य को प्राप्त नहीं किया (ऊपर को नहीं उड़ी, पक्षा०-गर्व को प्राप्त नहीं किया, क्योंकि उसने अपने गौरव के अनुरूप ही किया (अर्थात् जो उसके गौरव के अनुरूप था वही किया)।",पदविभागः -,न लङ्घयामास महाजनानां शिरांसि न एव उद्धतिम् आजगाम अचेष्टत अष्टापदभूमिरेणुः पदाहतः यत् सदृशं गरिम्णः ।,न लङ्घयामास महाजनानां शिरांसि नैवोद्धतिमाजगाम । अचेष्टताष्टापदभूमिरेणुः पदाहतो यत् सदृशं गरिम्णः ।।२८।।,28
अन्वयक्रमः -,तुरगाः यदुभिः कथञ्चित् निरुध्यमानाः (यत् ) अग्रपादान् मुहुः उच्चिक्षिपुः तत् ध्रुवं मार्गरुधः गुरून् करीन्द्रान् उल्लङघ्य गन्तुम् ईषुः ।,canto3,English Translation- ,"That the horses, though with great difficulty restrained by the Yadus, did now and again throw up their fore-legs, was certainly because they desired to go ahead of the best elephants who, great and worthy of respect, as they were, had obstructed their way.",हिन्दीभावार्थ -,(सेना में वर्तमान) घोड़े (अश्वारोही) यादवों के द्वारा किसी प्रकार (बड़े प्रयत्न से) रोके जाते हुए भी जो अगले पैरों को बार-बार ऊपर उठाते थे मानो वह निश्चय ही (मन्द मन्द गमन वाले) विशालकाय गजराजों को लाँघकर ही जाना चाहते थे ।,पदविभागः -,निरुध्यमानाः यदुभिः कथञ्चित् मुहुः उच्चिक्षिपुः अग्रपादान् ध्रुवं गुरून् मार्गरुधः करीन्द्रान् उल्लङ्घ्य गन्तुं तुरगाः तद् ईषुः ।,निरुध्यमाना यदुभिः कथञ्चिन्मुहुर्यदुच्चिक्षिपुरग्रपादान् । ध्रुवं गुरून्मार्गरुधः करीन्द्रानुल्लङ्घ्य गन्तुं तुरगास्तदीषुः ।।२९।।,29
अन्वयक्रमः -,आयतवल्गं यत्ननिरुद्धवाहैः तुरङ्गिभिः अग्रे अवेक्षितान् रेणुभिः प्रक्रीडितान् पृथुकान् जनन्यः तूर्णम् एत्य पथिभ्यः निन्युः ।,canto3,English Translation- ,"Mothers hastily took away their children from the roads, who were playing in the dust and who were seen in their front by their horsemen, who with difficulty curbed their horses by drawing up the reins.",हिन्दीभावार्थ -,लगाम खींचकर प्रयत्नपूर्वक घोडों को रोकने वाले घुड़सवारों के द्वारा देखे गए तथा (मार्ग में) धूलि से खेलते हुए बच्चों को (उनकी) माताएँ आकर झट से रास्ते से उठा ले गई ।,पदविभागः -,अवेक्षितान् आयतवल्गम् अग्रे तुरङ्गिभिः यत्ननिरुद्धवाहैः प्रक्रीडितान् रेणुभिः एत्य तूर्णं निन्युः जनन्यः पृथुकान् पथिभ्यः ।,अवेक्षितानायतवल्गमग्रे तुरङ्गिभिर्यत्ननिरुद्धवाहैः । प्रक्रीडितान् रेणुभिरेत्य तूर्णं निन्युर्जनन्यः पृथुकान् पथिभ्यः ।।३०।।,30
अन्वयक्रमः -,अनघं मुरारिं दिदृक्षमाणाः जनौघाः प्रतिरथ्यम् आराद् ईयुः । अहो! अनल्पा प्रीतिः अनेकशः संस्तुतम् अपि नवं नवं करोति ।,canto3,English Translation- ,"Crowds of people came from every street, desirous of having a sight of the sinless Śrī Kṛṣṇa. Oh! New and ever new does great love make a thing that though it has become familiar on many occasions in various ways.",हिन्दीभावार्थ -,निर्दोष भगवान् श्रीकृष्ण को देखने के इच्छुक जनसमुदाय प्रत्येक गली में (भगवान् श्रीकृष्ण के) समीप में आगये । आश्चर्य है कि अत्यधिक प्रेम अनेक बार परिचित वस्तु को भी नवीन बना देता है ।,पदविभागः -,दिदृक्षमाणाः प्रतिरथ्यम् ईयुः मुरारिम् आराद् अनघं जनौघाः अनेकशः संस्तुतम् अपि अनल्पा नवं नवं प्रीतिः अहो करोति ।,दिदृक्षमाणाः प्रतिरथ्यमीयुर्मुरारिमारादनघं जनौघाः । अनेकशः संस्तुतमप्यनल्पा नवं नवं प्रीतिरहो करोति ।।३१।।,31
अन्वयक्रमः -,"विद्वान्  तस्यां पुरि दत्तचक्षुः, असौ निरन्तराभिः अनीकिनीभिः निरुच्छ्वासं वर्त्म उपेयुषः रथस्य शनैः यातं न विदामास ।",canto3,English Translation- ,"He, (Śrī Kṛṣṇa) who knows everything, having fixed his gaze on that city, was not aware of the slow progress of his chariot when it had come to a road, too narrow for his compactly-formed armies.",हिन्दीभावार्थ -,विद्वान् उस नगरी द्वारकापुरी के देखने में लगाये हुए नेत्र वाले अर्थात् सजाई हुई द्वारकापुरी को देखते हुए वे भगवान् श्रीकृष्ण परस्पर में सटी हुई सेनाओं से ठसाठस भरे हुए मार्ग को प्राप्त रथ की मन्द गति को नहीं जान सके ।,पदविभागः -,उपेयुषः वर्त्म निरन्तराभिः असौ निरुच्छ्वासं अनीकिनीभिः रथस्य तस्यां पुरि दत्तचक्षुः विद्वान् विदामास शनैः न यातं ।,उपेयुषो वर्त्म निरन्तराभिरसौ निरुच्छ्वासमनीकिनीभिः । रथस्य तस्यां पुरि दत्तचक्षुर्विद्वान् विदामास शनैर्न यातम् ।।३२।।,32
अन्वयक्रमः -,मध्येसमुद्रं काञ्चनवप्रभासा ककुभः पिशङ्गीः कुर्वती या जलं भित्वा तुरङ्गकान्तामुखहव्यवाहज्वाला इव उल्ललास ।,canto3,English Translation- ,"The city which, in the midst of the sea, making the quarters tawny by the splendour of its golden rampart, had sprung up in splendour having broken upon the water, as if it were, the flame of the fire in mouth of the submarine fire.",हिन्दीभावार्थ -,(अब इकत्तीस श्लोकों में द्वारकापुरी का वर्णन करते हैं-) समुद्र के बीच अपने सोने के परकोटे की कान्ति से दिशाओं को पीला बनाती हुई जो द्वारकापुरी (समुद्र) के जल को भेदन करके (ऊपर उठी हुई) वडवानल की लपट के समान शोभित हो रही थी ।,पदविभागः -,मध्येसमुद्रम् ककुभः पिशङ्गीः या कुर्वती काञ्चनवप्रभासा तुरङ्गकान्तामुखहव्यवाहज्वाला इव भित्वा जलं उल्ललास ।,मध्येसमुद्रं ककुभः पिशङ्गीर्या कुर्वती काञ्चनवप्रभासा ।तुरङ्ककान्तामुखहव्यवाहज्वालेव भित्वा जलमुल्ललास ।।३३।।,33
अन्वयक्रमः -,"भूमिभृतां सहस्रैः कृतास्पदा (तथा) उदन्वदम्भःपरिवीतमूर्तिः, पृथ्वी या अनिर्विदा विधात्रा पृथिव्याः प्रतियातना इव विदधे ।",canto3,English Translation- ,"That extensive city, which was made their site by thousands of mountains and which had its form sorrounded by the waters of the ocean, had been made by the creator, as it were, as an image of the earth, while yet he had not been fatigued (in the work of creation).",हिन्दीभावार्थ -,हजारों राजाओं की निवासभूमि समुद्र के जल से परिवेष्टित स्वरूपवाली तथा विशाल जिस द्वारकापुरी को खेदरहित ब्रह्मा ने हजारों पर्वतों से युक्त (अधिष्ठित) तथा समुद्र-जल से परिवेष्टित पृथिवी की मानो प्रतिकृति के समान बनाया था ।,पदविभागः -,कृतास्पदा भूमिभृतां सहस्रैः उदन्वदम्भःपरिवीतमूर्तिः अनिर्विदा या विदधे विधात्रा पृथ्वी पृथिव्याः प्रतियातना इव ।,कृतास्पदा भूमिभृतां सहस्रैरुदन्वदम्भःपरिवीतमूर्तिः । अनिर्विदा या विदधे विधात्रा पृथ्वी पृथिव्याः प्रतियातनेव ।।३४।।,34
अन्वयक्रमः -,"त्वष्टुः सदाभ्यासगृहीतशिल्पविज्ञानसम्पत्प्रसरस्य सीमा, या आदर्शतलामलेषु जलधेः जलेषु स्वः छाया इव अदृश्यत ।",canto3,English Translation- ,"That city, the highest limit to which excellence of skill in architecture acquired by close study by Viśvakarman could go, looked as if it were the reflection of heaven, in the waters of the ocean, as clear as the surface of a mirror.",हिन्दीभावार्थ -,"विश्वकर्मा के निरन्तर अभ्यास से प्राप्त निर्माणकला की चातुर्यसम्पत्ति के उत्कर्ष की चरम अवधि रूप जो द्वारकापुरी, दर्पण के तल के समान स्वच्छ समुद्र के जल में स्वर्ग की मानो छाया के समान दृष्टिगोचर होती थी ।",पदविभागः -,त्वष्टुः सदाभ्यासगृहीतशिल्पविज्ञानसम्पत्प्रसरस्य सीमा अदृश्यत आदर्शतलामलेषु छाया इव या स्वः जलधेः जलेषु ।,त्वष्टुः सदाभ्यासगृहीतशिल्पविज्ञानसम्पत्-प्रसरस्य सीमा । अदृश्यतादर्शतलामलेषु छायेव या स्वर्जलधेर्जलेषु ।।३५।।,35
अन्वयक्रमः -,अम्बुधिः पिता इव वराय रथाङ्गभर्त्रे अभिनवं प्रतिपादितायाः अङ्कभाजः यस्याः उपकण्ठं मुहुः प्रेम्णा रत्नावलीः आबबन्ध ।,canto3,English Translation- ,"Close to her, who was situated near him and had been recently given to the noble Śrī Kṛṣṇa, out of love for him, the sea formed multitudes of jewels, just as the father of a bride, who has been just given to a husband, fastens round her neck, while she sits in his lap, necklaces of jewels.",हिन्दीभावार्थ -,"समुद्र, सुदर्शन चक्रधारी भगवान् श्रीकृष्ण के लिए तत्काल दी गयी तथा समीपवर्तिनी जिस द्वारकापुरी के समीप में प्रेम से रत्नावलियों को इस प्रकार बाँध (बिखेर) देता था, जिस प्रकार कि एक पिता, जामाता के लिए तुरन्त दी हुई तथा गोद में रहने वाली कन्या के कण्ठ में प्रेम से रत्नों के हार को पहना देता है ।",पदविभागः -,रथाङ्गभर्त्रे अभिनवं वराय यस्याः पिता इव प्रतिपादितायाः प्रेम्णा उपकण्ठं मुहुः अङ्कभाजः रत्नावली अम्बुधिः आबबन्ध ।,रथाङ्गभर्त्रेऽभिनवं वराय यस्याः पितेव प्रतिपादितायाः । प्रेम्णोपकण्ठं मुहुरङ्कभाजो रत्नावलीरम्बुधिराबबन्ध ।।३६।।,36
अन्वयक्रमः -,चलद्वारिधिवारिवीचिच्छटोच्छलच्छङ्खकुलाकुलेन यस्याः वप्रेण पर्यन्तचरोडुचक्रः सुमेरुवप्रः अन्वहम् अन्वकारि ।,canto3,English Translation- ,"By whose rampart, filled with multitudes of conches tossed by the series of rolling waves of the sea, was daily imitated the summit of Sumeru, with the constellations of stars moving round it.",हिन्दीभावार्थ -,चलती हुई समुद्र-जल की तरंगों से उछलते हुए शंखों के समूहों से व्याप्त जिस द्वारकापुरी के परकोटे ने चारों तरफ घूमते हुए नक्षत्रों वाले सुमेरु पर्वत का अनुकरण किया ।,पदविभागः -,यस्याः चलद्वारिधिवारिवीचिच्छटोच्छलच्छङ्खकुलाकुलेन वप्रेण पर्यन्तचरोडुचक्रः सुमेरुवप्रः अन्वहम् अन्वकारि ।,यस्याश्चलद्वारिधिवारिवीचिच्छटोच्छलच्छङ्खकुलाकुलेन । वप्रेण पर्यन्तचरोडुचक्रः सुमेरुवप्रोऽन्वहमन्वकारि ।।३७।।,37
अन्वयक्रमः -,"यत्र वणिक्पथे पूगकृतानि अलोद्युतिभाञ्जि रत्नानि, लोलैः (अत एव) भ्रमागतैः अम्बुभिः मुष्णन् अम्बुराशिः रत्नाकरताम् अवाप ।",canto3,English Translation- ,"On account of which, the ocean attained the position of Ratnākar  i.e., 'treasure of jewels', by carrying off with its rolling waters, jewels of steady lustre, piled in the market, ceaselessly entering the city through the flood-gates.",हिन्दीभावार्थ -,जिस द्वारकापुरी में बाजारों मे ढेर किये हुए स्थिर कान्ति वाले रत्नों को नालियों के द्वारा आये हुए (अपने) चञ्चल जलों से चुराते हुए जलराशि समुद्र ने रत्नाकरता को प्राप्त किया ।,पदविभागः -,वणिक्पथे पूगकृतानि यत्र भ्रमागतैः अम्बुभिः अम्बुराशिः लोलैः अलोलद्युतिभाञ्जि मुष्णन् रत्नानि रत्नाकरताम् अवाप ।,वणिक्पथे पूगकृतानि यत्र भ्रमागतेरम्बुभिरम्बुराशिः।लोलैरलोलद्युतिभाञ्जि मुष्णन् रत्नानि रत्नाकरतामवाप ।।३८।।,38
अन्वयक्रमः -,यत्र अपांनिधिः अम्भश्च्युतः फेनपिनद्धभासः कोमलरत्नराशीन् आतपे दातुम् इव अधितल्पं तरङ्गहस्तैः विस्तारयामास ।,canto3,English Translation- ,"Where the sea spread on the turrets with his hands in the form of waves heaps of excellent jewels dripping with water and having their lustre concealed in foam, as it were, to expose them to the Sun.",हिन्दीभावार्थ -,"जिस नगरी में समुद्र, जलों को टपकाते हुए तथा फेनों (समुद्रजल के झागों) से आच्छादित कान्ति वाले उत्तम रत्नसमूहों को, मानो धूप देने के लिए अटारियों के ऊपर अपने तरङ्गरूपी हाथों से फैला देता था ।",पदविभागः -,अम्भश्च्युतः कोमलरत्नराशीन् अपांनिधिः फेनपिनद्धभासः यत्र आतपे दातुम् इव अधितल्पं विस्तारयामास तरङ्गहस्तैः ।,अम्भश्च्युतः कोमलरत्नराशीनपांनिधिः फेनपिनद्धभासः । यत्रातपे दातुमिवाधितल्पं विस्तारयामास तरङ्गहस्तैः ।।३९।।,39
अन्वयक्रमः -,सागरस्य महोर्मिभिः यच्छालम् उत्तुङ्गतया विजेतुं दूराद् उदस्थीयत; अभ्यासगतैः व्याहतवाञ्छितार्थैः व्रीडात् इव विलिल्ये ।,canto3,English Translation- ,"To surpass the rampart of the city in height, the high billows of the sea rose at a great distance, but having been foiled in gaining their desired object when they got near, melted away, as if through shame.",हिन्दीभावार्थ -,"समुद्र की बड़ी-बड़ी तरङ्गें जिस द्वारकापुरी के परकोटे को ऊँचाई में मानो जीतने के लिए दूर से ऊपर की ओर उठीं, परन्तु समीप में आये हुए तथा (परकोटे के बहुत ऊँचा होने के कारण) नष्ट अभिलाष वाली वे तरंगें मानो लज्जा से विलीन हो गयीं ।",पदविभागः -,यच्छालम् उत्तुङ्गतया विजेतुं दूराद् उदस्थीयत सागरस्य महोर्मिभिः व्याहतवाञ्छितार्थैः व्रीडात् इव अभ्यासगतैः विलिल्ये ।,यच्छालमुत्तुङ्गतया विजेतुं दूरादुदस्थीयत सागरस्य । महोर्मिभिर्व्याहतवाञ्छितार्थैर्व्रीडादिवाभ्यासगतैर्विलिल्ये ।।४०।।,40
