anvaya,anvayaInfo,canto,english,englishInfo,hindi,hindiInfo,pada,padaInfo,sloka,slokaNo
अन्वयक्रमः -,पर्यच्छे सरसि पयोभिः अंशुके हृते (सति) सुरतगुरौ लोलाक्षे (सति) अपत्रपिष्णोः सुश्रोण्याः अब्जिनी द्रुतम् वीचिहस्तन्यस्तेन दलवसनेन सखीत्वम् अकृत ।,canto8,English Translation- ,"In a fresh-water of lake, when water removed garment of a woman, and when an amorous lover, was keen to see with his fickle eyes, (the middle place of her hip and loins) then, immediately, lotus, as if redeemed friendship gave garments of leaves, with her hands of waves to ashamed woman possessed with beautiful buttocks.",हिन्दीभावार्थ -,अत्यन्त निर्मल जल के सरोवर में जल के द्वारा (सुन्दरी के) वस्त्र को हटाये जाने पर और प्रिय के (उस वस्त्रहीन अङ्ग-श्रोणिभाग को देखने के लिए) चञ्चलनेत्र होने पर लज्जित हुई सुन्दर नितम्बवाली अङ्गना के वस्त्रहीन अंग को तत्काल तरङ्गरूपी हाथ से रखे गये कमलपत्ररूपी वस्त्र से आवृत कर कमलिनी ने सखी का कार्य किया ।,पदविभागः -,पर्यच्छे सरसि हृते अंशुके पयोभिः लोलाक्षे सुरतगुरौ अपत्रपिष्णोः सुश्रोण्याः दलवसनेन वीचिहस्तन्यस्तेन द्रुतम् अकृता अब्जिनी सखीत्वम् ।,पर्यच्छे सरसि हृतेंऽशुके पयोभिर्लोलाक्षे सुरतगुरावपत्रपिष्णोः । सुश्रोण्या दलवसनेन वीचिहस्तन्यस्तेन द्रुतमकृताऽब्जिनी सखीत्वम् ।।४६।।,46
अन्वयक्रमः -,नारीभिः गुरुजघनस्थलाहतानाम् आस्यश्रीविजितविकासिवारिजानां लोलत्वात् तदङ्गरागम् अपहरतां जलानां सः आशयः कलुषः सञ्जज्ञे ।,canto8,English Translation- ,"(As a thief's mindset while stealing something will be evil, similarly), a lake that possessed blossomed lotuses that were hit by large hips of women and which were defeated by the splendor of faces of women was polluted while stealing (erasing) the scented cosmetics of fickled nature, that were applied on women.",हिन्दीभावार्थ -,"नारियों के द्वारा बड़े-बड़े जघनस्थलों से ताडित, मुख-शोभा द्वारा पराजित, विकसित कमलोंवाले तथा चञ्चल होने से उन (अङ्गनाओं) के अङ्गराग (स्तनादि पर लगाये गये चन्दनादि सुवासित द्रव्य-लेप) का अपहरण करता (पक्षा० – दूर करता) हुआ वह जलाशय (पक्षा० मूर्खों का हृदय) मलिन (पक्षा० - क्षुब्ध) हो गया ।",पदविभागः -,नारीभिः गुरुजघनस्थलाहतानाम् आस्यश्रीविजितविकासिवारिजानां लोलत्वात् तदङ्गरागं सञ्जज्ञे सः कलुषः आशयः जलानाम् ।,नारीभिर्गुरुजघनस्थलाहतानामास्यश्रीविजितविकासिवारिजानाम् । लोलत्वादपहरतां तदङ्गरागं सञ्जज्ञे स कलुष आशयो जलानाम् ।।४७।।,47
अन्वयक्रमः -,"कामं सौगन्ध्यं दधत् अपि दूरत्वात् अङ्गनानाम् आननोपमानं गतम्, अहम् (सम्प्रति पुनः) तासां नेदीयः जितम् इति लज्जया एव महोत्पलम् आलोले पयसि ममज्ज ।",canto8,English Translation- ,"The lotus from a distance, (initially) thought that since it bore complete fragrance, it resembled the beauty of faces of beautiful women but when reached to their vicinity, it felt, as if it was defeated. Thus, out of shame, it immersed in rolling water.",हिन्दीभावार्थ -,"सम्पूर्ण प्रकार से सौरभ (पक्षा0 - सम्बन्ध) को धारण करता हुआ भी दूरवर्ती होने से (सुन्दरियों के) मुखसादृश्य को प्राप्त हुआ मैं उन (सुन्दरियों) के अत्यन्त निकट में होकर पराजित हो गया, इस लज्जा से ही महोत्पल चञ्चल जल में डूब गया ।",पदविभागः -,सौगन्ध्यं दधत् अपि कामम् अङ्गनानां दूरत्वात् गतम् आननोपमानं नेदीयः जितम् इति लज्जया एव तासाम् आलोले पयसि महोत्पलं ममज्ज ।,सौगन्ध्यं दधदपि काममङ्गनानां दूरत्वाद्गतमहमाननोपमानम् । नेदीयो जितमिति लज्जयेव तासामालोले पयसि महोत्पलं ममज्ज ।।४८।।,48
अन्वयक्रमः -,सरभसम् अम्भसः अवगाहक्रीडाभिः प्रभ्रष्टैः विदलितयूथिकापिशङ्गैः हिरण्मयैः वधूनाम् आकल्पैः सरसि और्वाग्निद्युतिशकलैः इव व्यराजि ।,canto8,English Translation- ,"Fallen in water, while playing water games of immersion hastily, golden ornaments of women that were appearing like blossomed yellow Jasminum flower, resembled like fragments of flames of fire of submarine in a lake.",हिन्दीभावार्थ -,त्वरा से जल में अवगाहनरूप क्रीडाओं से गिरे हुए प्रफुल्लित पीतपुष्पवाली जूही के सदृश पीत वर्णवाले  सुवर्णनिर्मित अङ्गनाओं के आभूषण सरोवर में बडवाग्नि की ज्वाला के खण्ड के सदृश परिलक्षित हो रहे थे ।,पदविभागः -,प्रभ्रष्टैः सरभसम् अम्भसः अवगाहक्रीडाभिः विदलितयूथिकापिशङ्गैः आकल्पैः सरसि हिरण्मयैः वधूनाम् और्वाग्निद्युतिशकलैः इव व्यराजि ।,प्रभ्रष्टैः सरभसमम्भसोऽवगाहक्रीडाभिर्विदलितयूथिकापिशङ्गैः । आकल्पैः सरसि हिरण्मयैर्वधूनामौर्वाग्निद्युतिशकलैरिव व्यराजि ।।४९।।,49
अन्वयक्रमः -,आस्माकी असौ छाया एव युवतिदृशाम् अनपायिनीं श्रियं तनोति इति एभिः (कज्जलैः) किम् (एतत् साध्यं भवति) ? एवं मत्वा स्वगुणपिधानसाभ्यसूयैः पानीयैः अञ्जनानि विदधाविरे ।,canto8,English Translation- ,"When our pure splendor itself endures an eternal beauty to the eyes of these beautiful young women, then what is the use of this (collyrium)? Having thought thus, water out of jealousy as it hid its virtues, neatly washed away (that) collyrium.",हिन्दीभावार्थ -,"हमारी यह कान्ति ही इन युवतियों के नेत्रों की स्थायी शोभा को बढ़ा रही है, तो फिर इस (कज्जल) में क्या लाभ?  निश्चित ही कुछ नहीं, मानो ऐसा विचार कर अपने (निर्मल) गुण को छिपाने से ईर्षालु जल ने (अङ्गनाओं के नेत्रों में लगे हुए) अञ्जन को अच्छा धो डाला ।",पदविभागः -,आस्माकी युवतिदृशाम् असौ तनोति छाया एव श्रियम् अनपायिनीं किम् एभिः मत्वा एवं स्वगुणपिधानसाभ्यसूयैः पानीयैः इति विदधाविरे अञ्जनानि ।,आस्माकी युवतिदृशामसौ तनोतिच्छायेव श्रियमनपायिनीं किमेभिः । मत्वैवं स्वगुणपिधानसाभ्यसूयैः पानीयैरिति विदधाविरेऽञ्जनानि ।।५०।।,50
अन्वयक्रमः -,आपाण्डोः अङ्गनायाः स्तनकलशद्वयात् हरिचन्दने जलौघैः निर्धौते सति गतपरभागया हारयष्ट्या सहृदयया इव  अह्नाय विच्छेदः उपेये  ।,canto8,English Translation- ,"When water erased scented cosmetics from the jar like (two) breasts of women, it was as if, due to less entity of color, pearl string, like a good-hearted, immediately broke down.",हिन्दीभावार्थ -,अङ्गनाओं के दोनों स्तनकलशों पर लिप्त हरिचन्दन का लेप जल के द्वारा प्रक्षालित हो जाने पर अङ्गनाओं के स्वच्छ दोनों स्तनकलशों से मन्द (क्षीण) कान्तिवाला मुक्ताहार मानो सहृदय के सदृश तत्काल टूट गया ।,पदविभागः -,निर्धौते सति हरिचन्दने जलौघैः आपाण्डोः गतपरभागया अङ्गनायाः अह्नाय स्तनकलशद्वयात् उपेये विच्छेदः सहृदयया इव हारयष्ट्या ।,निर्धौते सति हरिचन्दने जलौघैरापाण्डोर्गतपरभागयाऽङ्गनायाः । अह्नाय स्तनकलशद्वयादुपेये विच्छेदः सहृदययेव हारयष्ट्या ।।५१।।,51
अन्वयक्रमः -,अन्यूनम् अमृतस्य गुणं धारयन्ती सम्फुल्लस्फुरितसरोरुहावतंसा प्रेयोभिः सह निषेव्यमाणा सरसी सुरा इव वधूदृशां रक्तत्वं व्यधित ।,canto8,English Translation- ,"Women who enjoyed water sports along with their beloved in a lake resembled fully blossomed and bright lotuses as that lake possessing all virtues of ambrosia, enacted as wine by reddening the eyes of those ladies.",हिन्दीभावार्थ -,"जल के माधुर्यादि समग्र गुणों से समन्वित तथा सम्यक् प्रकार से विकसित एवं उज्ज्वल कमलरूपी आभूषणोंवाली और प्रिय के साथ में सेवित उस सरसी ने, तथा (यज्ञविशिष्ट होने से) अमृत के समस्त गुणों को धारण करती हुई तथा सम्यक् प्रकार से विकसित एवं उज्ज्वल कमलरूपी भूषणोंवाली और अपने वल्लभों के साथ सेवित मदिरा ने अङ्गनाओं के नेत्रों को आरक्त कर दिया, अर्थात् दीर्घकाल तक जलक्रीडा करने से कोमलाङ्गनाओं के नेत्र रक्त वर्ण के हो गये ।",पदविभागः -,अन्यूनं गुणम् अमृतस्य धारयन्ती सम्फुल्लस्फुरितसरोरुहावतंसा प्रेयोभिः सह सरसी निषेव्यमाणा रक्तत्वं व्यधित वधूदृशां सुरा इव ।,अन्यूनं गुणममृतस्य धारयन्ती सम्फुल्लस्फुरितसरोरुहावतंसा । प्रेयोभिः सह सरसी निषेव्यमाणा रक्तत्वं व्यधित वधूदृशां सुरेव ।।५२।।,52
अन्वयक्रमः -,स्नान्तीनां रुचिरदृशां बृहृदमलोदबिन्दुचित्रौ उरोजकुम्भौ उत्सूत्रैः हाराणां मणिभिः गुणवदुपघ्नकाम्यया समन्तात् उपाश्रितौ इव रेजाते ।,canto8,English Translation- ,"Two huge jars like breasts of women possessed with beautiful eyes when bathing (in a lake) with big droplets on them were very much splendorous that, though those (two breasts) were not owning any (pearl) string, were appearing as if pearls were assembled around them to take abode of them.",हिन्दीभावार्थ -,"स्नान करती हुई सुन्दर नेत्रोंवाली अङ्गनाओं के जल के बड़ी-बड़ी बूँदों से चित्रित दोनों स्तनकलश इस प्रकार दिखाई दे रहे थे, मानो सूत्ररहित (किन्तु) गुणयुक्त स्तनों के आश्रय करने की अभिलाषा से उनके चारों ओर एकत्र हो रहे हों ।",पदविभागः -,स्नान्तीनाम् बृहृदमलोदबिन्दुचित्रौ रेजाते रुचिरदृशाम् उरोजकुम्भौ हाराणां मणिभिः उपाश्रितौ समन्तात् उत्सूत्रैः गुणवदुपघ्नकाम्यया इव ।,स्नान्तीनां बृहृदमलोदबिन्दुचित्रौ रेजाते रुचिरदृशामुरोजकुम्भौ । हाराणां मणिभिरुपाश्रितौ समन्तादुत्सूत्रैर्गुणवदुपघ्नकाम्ययेव ।।५३।।,53
अन्वयक्रमः -,स्वसम्भवः अपि आरूढः पतितः इति स्वच्छानां परिहरणीयताम् उपैति यत् आपः वधूनां कर्णेभ्यः च्युतम् असितोत्पलं वीचिभिः तटम् अनु निरासुः ।,canto8,English Translation- ,"Just as a noble person who attained a high position, expels his progeny, when it adopts vicious path, similarly water also with its waves, threw blue lotus that fell from the ears of women, towards (its) bank.",हिन्दीभावार्थ -,"उच्चस्थान पर पहुँचा हुआ (पक्षा0- श्रेष्ठ पद को प्राप्त किया हुआ) अपने से उत्पन्न (पक्षा0 – आत्मज, पुत्र आदि) भी पतित होकर (पक्षा0 – नीच कर्म करने के कारण भ्रष्ट होकर) निर्मल (पक्षा0 - दोषहीन) लोगों के द्वारा त्याज्य होता है, अर्थात् श्रेष्ठ पद को प्राप्त कर पुनः निन्द्यकर्म करने वाले आत्मज (पुत्र आदि) को भी दोषहीन सज्जन त्याग देते हैं, इसको स्मरण कर अङ्गनाओं के कानों से गिरे हुए अपने में उत्पन्न भी नीलकमलों को जल ने तरंगों के द्वारा तट की ओर फेंक दिया ।",पदविभागः -,आरूढः पतितः इति स्वसम्भवः अपि स्वच्छानां परिहरणीयताम् उपैति कर्णेभ्यः च्युतम् असितोत्पलं वधूनां वीचिभिः तटम् अनु यत् निरासुः आपः ।,आरुढः पतित इति स्वसम्भवोऽपि स्वच्छानां परिहरणीयतामुपैति ।कर्णेभ्यश्च्युतमसितोत्पलं वधूनां वीचीभिस्तटमनु यन्निरासुरापः ।।५४।।,54
अन्वयक्रमः -,अधितोयम् अङ्गनानाम् अयावकम् अधरं दन्तानां पदानि (श्रियम्) (आनिन्युः) अविलेपनां तनुं प्रत्यग्राः नखाङ्काः श्रियम् आनिन्युः (तथाहि-) सदाश्रिताः विपदि शोभायै भवन्ति ।,canto8,English Translation- ,"While playing water sports in a lake, lips of women that were devoid of the color of lac, wounds on their lips covered their color, and though their body was lacking scented cosmetics, new scars of nails gave beauty to it. Indeed, resorting to virtuous people is graceful at times of adversities.",हिन्दीभावार्थ -,"सरोवर में जलक्रीडा करते समय अङ्गनाओं के (जल से प्रक्षालित होने के कारण) अलक्तकरहित अधरों को दन्तक्षतों ने तथा कुङ्कुमादि सुवासित द्रव्यों के लेपरहित शरीर को अभिनव नखक्षतों ने शोभासम्पन्न कर दिया, क्योंकि सज्जनों (पक्षा0-सुन्दर शरीरवालों) के आश्रय में रहनेवाले विपत्ति में शोभा के लिए होते हैं ।",पदविभागः -,दन्तानाम् अधरम् अयावकं पदानि प्रत्यग्राः तनुम् अविलेपनां नखाङ्काः अनिन्युः श्रियम् अधितोयम् अङ्गनानां शोभायै विपदि सदाश्रिताः भवन्ति ।,दन्तानामधरमयावकं पदानि प्रत्यग्रास्तनुमविलेपनां नखाङ्काः । आनिन्युः श्रियमधितोयमङ्गनानां शोभायै विपदि सदाश्रिता भवन्ति ।।५५।।,55
अन्वयक्रमः -,धौतपत्रलेखं कस्याश्चित् मुखम् अनु सलिलभरावलम्बिनीभिः किञ्जल्कव्यतिकरपिञ्जरान्तराभिः अलकाग्रवल्लरीभिः चित्रश्रीः अलं व्यातेने ।,canto8,English Translation- ,"Some other woman while playing in the water, though her scented cosmetics were washed off with creepers and filaments of lotus in her hair locks that came due to the powerful water streams, it variegated her.",हिन्दीभावार्थ -,(जलक्रीडा के अवसरपर जल से) प्रक्षालित (धुली) हुई पत्रलेखा (मुख पर चन्दनादि से अंकित पत्रलता आदि) वाले किसी सुन्दरी के मुख पर जलप्रवाह के वेग से लम्बे तथा मध्य में कमलकेसर के चिपक जाने से पीतवर्ण की लता के सदृश ने (मकरपत्रादि के) चित्र की शोभा को प्राप्त करा दिया । अर्थात् चन्दनादि से अंकित मकरादि चित्रों से रहित भी रमणी का मुख लम्बे-लम्बे एवं मध्य में कमलकेसरयुक्त केशाग्र भागों से मकर-पत्रादि के चित्र से युक्त के सदृश परिलक्षित होने लगा ।,पदविभागः -,कस्याश्चित् मुखम् अनु धौतपत्रलेखं व्यातेने सलिलभरावलम्बिनीभिः किञ्जल्कव्यतिकरपिञ्जरान्तराभिः चित्रश्रीः अलं अलकाग्रवल्लरीभिः ।,कस्याश्चिन्मुखमनु धौतपत्रलेखं व्यातेने सलिलभराऽवलम्बिनीभिः । किञ्जल्कव्यतिकरपिञ्जरान्तराभिश्चित्रश्रीरलमलकाग्रल्लरीभिः ।।५६।।,56
