anvaya,anvayaInfo,canto,english,englishInfo,hindi,hindiInfo,pada,padaInfo,sloka,slokaNo
अन्वयक्रमः -,मृत्पिण्डशेखरितकोटिभिः (अत एव-) शिखाग्रगतलक्ष्ममलम् अर्धचन्द्रं हसद्भिः श्रृङ्गैः उच्छृङ्गितान्यवृषभाः (अत एव) धीरं नदन्तः महोक्षाः सरितां रोधांसि अवचस्करिरे।,canto5,English Translation- ,"Big bulls that have adorned mud particles as their head-ornaments due to playful butting against a bank and which possessed with blemishes in two edges, it was appearing as if, they were humiliating the crescent moon as they were roaring while exterminating the horns of other bulls, have exterminated the watersides.",हिन्दीभावार्थ -,"(नदियों के गीले तटों को उखाड़ने से लगी हुई) मिट्टी के टुकडों से शिरोभूषणयुक्त अग्रभागों वाले, अत एव दोनों सिरों पर लगे हुए कलङ्क रूपी मल वाले आधे चन्द्रमा की हँसी उडाते हुए अर्थात् कलङ्क रूपी मल युक्त चन्द्रमा की अपेक्षा अधिक शोभित होते हुए सींगों से दूसरे बैलों के सींगों को जिन्होंने उखाडडाला है, अत एव – जो गम्भीर गर्जना कर रहे हैं, इस प्रकार के बडे बैलों (या सांडों) ने नदियों के तटों को उखाड डाला ।",पदविभागः -,मृत्पिण्डशेखरितकोटिभिः अर्धचन्द्रं श्रृङ्गैः शिखाग्रगतलक्ष्ममलं हसद्भिः उच्छृङ्गितान्यवृषभाः सरितां नदन्तः रोधांसि धीरम् अवचस्करिरे महोक्षाः।,मृत्पिण्डशेखरितकोटिभिरर्धचन्द्रं श्रृङ्गैः शिखाग्रगतलक्ष्ममलं हसद्भिः। उच्छृङ्गितान्यवृषभाः सरितां नदन्तो रोधांसि धीरमवचस्करिरे महोक्षाः ।।६३।।,63
अन्वयक्रमः -,ऊर्जस्वलेन उक्ष्णा मेदस्विनः (अत एव) सरभसोपगतान् अभीकान् परान् अनडुहः मुहुः आहवेन भङ्क्त्वा जयोद्धुरविशालविषाणं निःसपत्नं सुरभीः अनु जग्मे ।,canto5,English Translation- ,"A strong bull, when often defeated some other bold bulls and having won over had put its head up with its big horns, one without enemies, went behind cows.",हिन्दीभावार्थ -,"बलिष्ठ बैल, मांसल अर्थात् – मोटे , अत एव – वेगपूर्वक आये हुए कामुक दूसरे बैलों को बार बार युद्ध में हराकर विजयलाभ से ऊपर को किये हुए एवं विशाल सींगों से युक्त होकर प्रतिपक्षियों से रहित हुआ गायों के पीछे लग गया ।",पदविभागः -,मेदस्विनः सरभसोपगतान् अभीकान् भङ्क्त्वा परान् अनडुहः मुहुः आहवेन ऊर्जस्वलेन सुरभीः अनु निःसपत्नं जग्मे जयोद्धुरविशालविषाणम् उक्ष्णा ।,मेदस्विनः सरभसोपगतानभीकान् भङ्कत्वा पराननडुहो मुहुराहवेन । ऊर्जस्वलेन सुरभीरनु निःसपत्नं जग्मे जयोद्धुरविशालविषाणमुक्ष्णा ।।६४।।,64
अन्वयक्रमः -,आयतिमतीम् अवृथा शिरोधिं बिभ्राणम् उदग्रमुखम् औष्ट्रकम् अतिरसाम् प्रत्यग्रताम् अधिकं दधन्ति अभ्रंलिहानि तरूणां नवपल्लवानि लोलोष्ठं लिलिहे ।,canto5,English Translation- ,"The multitude of camels, bearing long throat, which is of very much useful to grab leaves, etc., having turned its neck upwards, licked juicy, tender leaves that were on the top of trees that were resembling as if they were kissing the sky.",हिन्दीभावार्थ -,"दीर्घ तथा पल्लवादि ग्रहण करने से सार्थक गर्दन को धारण किये हुए एवं ऊपर को मुख उठाये हुए ऊँटों का समूह, अत्यन्त रस से युक्त एवं नवीनता से युक्त, तथा आकाश को चूमने वाले अर्थात् – अत्यन्त ऊँचे वृक्षों के नवीन पत्तों को (अपने) चपलोष्ट से चाटने लगा ।",पदविभागः -,बिभ्राणम् आयतिमतीम् अवृथा शिरोधिं प्रत्यग्रताम् अतिरसाम् अधिकं दधन्ति लोलोष्ठम् औष्ट्रकम् उदग्रमुखम् तरूणाम् अभ्रंलिहानि लिलिहे नवपल्लवानि ।,बिभ्राणमायतिमतीमवृथा शिरोधिं प्रत्यग्रतामतिरसामधिकं दधन्ति । लोलोष्ठमौष्ट्रकमुदग्रमुखं तरूणामभ्रंलिहानि लिलिहे नवपल्लवानि ।।६५।।,65
अन्वयक्रमः -,उचितैः पिचुमर्दपत्रैः सार्धं कथञ्चित् आस्यान्तरालगतं म्रदीयः आम्रदलं दासेरकः पुरा निषादैः संवलितं विप्रं पतगराट् इव सपदि निर्जगार ।,canto5,English Translation- ,"When a camel which was used to eat leaves of the neem tree, somehow ate tender leaves of mango, immediately spit them just as once upon a time Garuḍa had spit out a Brāhmin, whom, by mistake took him into his mouth along with some mountaineers.",हिन्दीभावार्थ -,"(सदा खाते रहने से) अभ्यस्त नीम के पत्तों के साथ किसी प्रकार मुख के भीतर गये हुए कोमल आम के पत्तों को ऊँट ने तत्काल उसी प्रकार उगल दिया, जिस प्रकार (अनेक बार खाये जाने से परिचित) निषादों के साथ किसी प्रकार (असावधानी से) मुख के भीतर गये हुए ब्राह्मण को पहले गरुड ने उगल दिया था ।",पदविभागः -,सार्धं कथञ्चित् उचितैः पिचुमर्दपत्रैः आस्यान्तरालगतम् आम्रदलं म्रदीयः दासेरकः सपदि संवलितं निषादैः विप्रं पुरा पतगराट् इव निर्जगार ।,सार्धं कथञ्चिदुचितैः पिचुमर्दपत्रैरास्यन्तरालगतमाम्रदलं म्रदीयः । दासेरकः सपदि संवलितं निषादैर्विप्रं पुरा पतगराडिव निर्जगार ।।६६।।,66
अन्वयक्रमः -,बहिः स्थितवते अपि अनुजीविजनाय राज्ञां चेष्टाविशेषं स्पष्टं निवेदयन्तः कलगिरः वैतालिकाः अवसरेषु स्फुटपदप्रकटार्थम् उच्चैः भोगावलीः पेठुः ।,canto5,English Translation- ,"Poets sang melodiously, clearly and loudly some unique poems called 'Bhogāvalī,' that contain clear and elucidate meaning, while narrating the then great activities of kings, even to the attenders who sat outside.",हिन्दीभावार्थ -,(राजाओं से मिलने के लिये) बाहर बैठे हुए अनुचरों के लिये भी (राजस्तुति द्वारा ही) राजाओं की चेष्टाओं (उस समय के कार्य विशेषों) को स्पष्ट निवेदन करते हुए मधुरभाषी वैतालिक लोग उस समय स्पष्ट (श्लेषादि से रहित) पदों से विशद अर्थ युक्त भोगावलियों को उच्च स्वर से पढ़ने लगे ) ।,पदविभागः -,स्पष्टं बहिः स्थितवते अपि निवेदयन्तः चेष्टाविशेषम् अनुजीविजनाय राज्ञां वैतालिकाः स्फुटपदप्रकटार्थम् उच्चैः भोगावलीः कलगिरः अवसरेषु पेठुः ।,स्पष्टं बहिः स्थितवतेऽपि निवेदयन्तश्चेष्टाविशेषमनुजीविजनाय राज्ञाम् । वैतालिकाः स्फुटपदप्रकटार्थमुच्चैर्भोगावलीः कलगिरोऽवसरेषु पेठुः ।।६७।।,67
अन्वयक्रमः -,उन्नम्रताम्रपटमण्डपमण्डितम् आनीलनागकुलसङ्कुलम् (अत एव-) सन्ध्यांशुभिन्नघनकर्बुरितान्तरीक्षलक्ष्मीविडम्बि शिवकीर्तनस्य तत् शिबिरम् आबभासे ।,canto5,English Translation- ,"The red and long canopy of Śrī Kṛṣṇa, whose name itself causes welfare, outspread with a multitude of dark black elephants, splendrous like the sky with dappled clouds became graceful.",हिन्दीभावार्थ -,"ऊँचे तथा लाल तम्बुओं से सुशोभित अत्यन्त काले हाथियों के झुण्डों से व्याप्त, अत एव-सायं कालीन किरणों से मिश्रित (कृष्ण वर्ण वाले) बादलों से चितकबरे आकाश की शोभा का अनुकरण करने वाला अर्थात् – आकाश के समान सुशोभित, मङ्गलकारक नामोच्चारण वाले भगवान् श्रीकृष्ण का वह प्रसिद्ध शिबिर सुशोभित हो गया ।",पदविभागः -,उन्नम्रताम्रपटमण्डपमण्डितं तत् आनीलनागकुलसङ्कुलम् आबभासे सन्ध्यांशुभिन्नघनकर्बुरितान्तरीक्षलक्ष्मीविडम्बि शिबिरं शिवकीर्तनस्य ।,उन्नम्रताम्रपटमण्डपमण्डितं तदानीलनागकुलसङ्कुलमाबभासे । सन्ध्यांशुभिन्नघनकर्बुरितान्तरीक्षलक्ष्मीविडम्बि शिबिरं शिवकीर्तनस्य ।।६८।।,68
अन्वयक्रमः -,"बलाक्रान्तः असौ गिरिपतिः क्रीडद्द्विरदमथितोर्वीरुहरवैः श्रीपतिं ननु त्वं धरस्य उद्धर्ता असि, इति सर्वत्र जगति (त्वं) प्रतीतः (असि) तत् किम् अतिभरं माम् (त्वम्) अधः प्रापिपयिषुः (असि) इति उच्चैः उपालब्धः इव ।",canto5,English Translation- ,"Raivataka, king of mountains, occupied by the army, with the sound of trees that were broken by the elephants while playing reproached Śrī Kṛṣṇa loudly, thus - “You are popular everywhere in the world as the one who uplifted the Govardhana mountain. Why is that you want to send me, who is heavily loaded, to the downwards.",हिन्दीभावार्थ -,सेनाओं से आक्रान्त यह पर्वतराज (रैवतक) क्रीडा करते हुए हाथियों से तोड़े गये वृक्षों के शब्दों से लक्ष्मीपति भगवान् श्रीकृष्ण को उच्च स्वर से इस प्रकार उलाहना देने लगा कि हे भगवान्! आप सम्पूर्ण संसार में (गोवर्धन) पर्वत का उद्धार करने (ऊपर को उठाने) वाले प्रसिद्ध हैं । इसलिये क्यों (अपनी सेना तथा कुक्षि में त्रिलोक का भार ग्रहण कर मुझ पर निवास करने से) अत्यन्त भार युक्त मुझको नीचे (पाताल लोक में) पहुँचाना चाहते हैं ।,पदविभागः -,"धरस्य उद्धर्ता असि त्वम् इति ननु सर्वत्र जगति प्रतीतः, तत् किम् माम् अतिभरम् अधः प्रापिपयिषुः उपालब्धः इव उच्चैः गिरिपतिः इति श्रीपतिम् असौ बलाक्रान्तः क्रीडद्द्विरदमथितोर्वीरुहरवैः ।",धरस्योद्धर्तासि त्वमिति ननु सर्वत्र जगति प्रतीतस्तत्किं मामतिभरमधः प्रापिपयिषुः । उपालब्धेवोच्चैर्गिरिपतिरिति श्रीपतिमसौ बलाक्रान्तः क्रीडद्द्विरदमथितोर्वीरुहरवैः ।।६९।।,69
अन्वयक्रमः -,अथ गिरौ रिरंसुं सतां विपदन्तकृतम् अमुं निषेवितुं कृतयथास्वतरुप्रसवश्रिया ऋतुगणेन युगपत् भुवि पदम् आदधे ।,canto6,English Translation- ,"After the military array has halted, a group of seasons at once had arrived, while producing the beauty of buds and flowers according to their trees, to serve Lord Śrī Kṛṣṇa, who was desirous to enjoy on the Raivataka mountain and who eliminates the troubles of the good.",हिन्दीभावार्थ -,"अब रैवतक पर्वत पर भगवान् श्रीकृष्ण के विहार प्रसंग में ऋतुओं का वर्णन करने के लिये छठे सर्ग का आरम्भ करते हैं | अब सेना निवेश के बाद रैवतक पर्वत पर रमण करने के इच्छुक तथा सज्जनों की विपत्ति को दूर करने वाले इस श्रीकृष्ण भगवान् की सेवा करने के लिये अपने वृक्षों के अनुसार पल्लव तथा पुष्पादि की शोभा को उत्पन्न किये हुए ऋतु समूह ने एक साथ पृथिवी पर पैर रखा, अर्थात् सब ऋतुएँ एक साथ प्रकट हुईं (अपने-अपने चिह्नों को प्रकट किया) ।",पदविभागः -,अथ रिरंसुम् अमुं युपगद् गिरौ कृतयथास्वतरुप्रसवश्रिया ऋतुगणेन निषेवितुम् आदधे भुवि पदं विपदन्तकृतं सताम् ।,अथ रिरंसुममुं युगपद् गिरौ कृतयथास्वतरुप्रसवश्रिया । ऋतुगणेन निषेवितुमादधे भुवि पदं विपदन्तकृतं सताम् ।।१।।,1
अन्वयक्रमः -,सः पुरः नवपलाशपलाशवनं स्फुटपरागपरागतपङ्कजं मृदुलतान्तलतान्तं सुमनोभरैः सुरभिं सुरभिम् अलोकयत् ।,canto6,English Translation- ,"Lord Śrī Kṛṣṇa first saw fragrant spring season with a bunch of flowers with tender leaves of red lac called 'Palāśa' and that which is spread with blossomed lotuses, which are king of flowers and tender buds that are faded due to heat.",हिन्दीभावार्थ -,"(यद्यपि छ ऋतुओं ने एक साथ रैवतक पर्वत पर अपना-अपना कार्य आरम्भ किया, अर्थात् एक साथ प्रकट हुई, किन्तु छ ऋतुओं का वर्णन एक साथ करना असम्भव होने से यहाँ वसन्तादि क्रम से छ ऋतुओं का वर्णन किया गया है । इनमें सर्वप्रथम वसन्त ऋतु का वर्णन बीस श्लोकों (6-2-21) से करते हैं – श्रीकृष्ण भगवान् ने पहले नवीन पत्तों से युक्त, ढाक के वनों वाले विकसित तथा पुष्पराजों से व्याप्त कमलों वाले, कोमल अत एव गर्मी से कुछ म्लान पल्लवों से युक्त, पुष्पसमूहों से सुगन्धित वसन्त ऋतु को देखा ।",पदविभागः -,नवपलाशपलाशवनं पुरः स्फुटपरागपरागतपङ्कजं मृदुलतान्तलतान्तम् अलोकयत् सः सुरभिं सुरभिं सुमनोभरैः ।,नवपलाशपलाशवनं पुरः स्फुटपरागपरागतपङ्कजम् । मृदुलतान्तलतान्तमलोकयत् स सुरभिं सुरभिं सुमनोभरैः ।।२।।,2
अन्वयक्रमः -,विलुलितालकसंहतिः मृगदृशां ललाटजं श्रमवारि आमृशन् सरसां तनुतरङ्गततिं दलत्कुवलयं वलयन् मरुत् आववौ ।,canto6,English Translation- ,"The wind of spring season, while swaying away from the multitude of hair of the deer-eyed women and while removing sweat on their foreheads, and while swaying the stratum of waves of water of blossoming lotus-pond, blew.",हिन्दीभावार्थ -,"मृगनयनियों के केशकलाप को हिलाने वाला तथा उनके ललाट (माथे) से उत्पन्न पसीने को दूर करता हुआ नील कमलों के विकासपूर्वक जलाशय की तरङ्गश्रेणी को धीरे-धीरे हिलाता हुआ (वसन्तऋतु का) वायु चलने लगा, अर्थात् शीतल, मन्द, सुगन्ध वायु बहने लगा ।",पदविभागः -,विलुलितालकसंहतिः आमृशन् मृगदृशां श्रमवारि ललाटजं तनुतरङ्गततिं सरसां दलत्कुवलयं वलयन् मरुत् आववौ ।,विलुलितालकसंहतिरामृशन् मृगदृशां श्रमवारि ललाटजम् । तनुतरङ्गततिं सरसां दलत्कुवलयं वलयन्मरुदाववौ ।।३।।,3
अन्वयक्रमः -,कुरबकस्तबकव्यतिषङ्गिणि (अत एव) गुणवदाश्रयलब्धगुणोदये अलिनि मलिनिमा माधवयोषितां विलोचनतारकाः तुलयति स्म ।,canto6,English Translation- ,"Having sat on the bunches of red Amarānth, bumble-bees have obtained eminence of the attribute, i.e., the blackness of those bunches and that (blackness) of bumble-bees has equaled the eye-ball of women of Lord Śrī Kṛṣṇa.",हिन्दीभावार्थ -,"कुरबक के गुच्छे पर बैठे हुए, अत एव- (श्वेत) गुणयुक्त (कुरबक स्तबक का) आश्रय (लेने) से प्राप्त कर लिया है गुण (कालिमा) के उत्कर्ष को जिसने, उस भौंरे में (स्थित) कालिमा ने यादवों अथवा श्रीकृष्ण भगवान् की स्त्रियों के नेत्रों की (काली) पुतलियों की समता की ।",पदविभागः -,तुलयति  स्म विलोचनतारकाः कुरबकस्तबकव्यतिषङ्गिणि गुणवदाश्रयलब्धगुणोदये  मलिनिमा अलिनि माधवयोषिताम् ।,तुलयति स्म विलोचनतारकाः कुरबकस्तबकव्यतिषङ्गिणि । गुणवदाश्रयलब्धगुणोदये मलिनिमालिनि माधवयोषिताम् ।।४।।,4
